Link,Source website,Website link,Title,Description,Author,Published date,Type,Image
https://blockworks.co/advertise,Blockworks,https://blockworks.co/search,Blockworks: News and insights about digital assets.,"Blockworks is a financial media brand that delivers breaking news and premium insights about digital assets to millions of investors. Our editorial content, newsletters, podcasts and events provide investors with the critical analysis and information they need to make smarter decisions about digital assets.",Blockworks,2024-05-07,News,https://blockworks.co/images/blockworks-og-image.webp
https://blockworks.co/trust-ethics,Blockworks,https://blockworks.co/search,Trust and Ethics - Blockworks,"Blockworks is a financial media brand that delivers breaking news and premium insights about digital assets to millions of investors. Our editorial content, newsletters, podcasts and events provide investors with the critical analysis and information they need to make smarter decisions about digital assets.",Blockworks,2024-05-07,News,https://blockworks.co/images/blockworks-og-image.webp
https://blockworks.co/news/ore-wins-50k-solana-hackathon,Blockworks,https://blockworks.co/search,Solana congestion culprit Ore wins $50K from hackathon,"Ore won $50,000 from a Solana Foundation-supported hackathon focused on identifying Solana’s “next wave of high-impact projects.”",Jack Kubinec,2024-05-06,News,https://blockworks.co/_next/image?url=https://blockworks-co.imgix.net/wp-content/uploads/2024/05/solana.jpg&w=1920&q=75&webp=false
https://blockworks.co/category/op-ed,Blockworks,https://blockworks.co/search,Op-Ed News & Insights - Blockworks,There are a total of 364 articles associated with Op-Ed.,Blockworks,2024-05-06,News,https://blockworks.co/images/blockworks-og-image.webp
https://blockworks.co/news/gbtc-posts-first-net-inflows,Blockworks,https://blockworks.co/search,Bitcoin ETF snapshot: GBTC surprise helps end sector’s seven-day outflow run,"Grayscale’s spot bitcoin ETF notched positive flows for the first time since becoming an ETF, ending a 78-day outflow run.",Ben Strack,2024-05-06,News,https://blockworks.co/_next/image?url=https://blockworks-co.imgix.net/wp-content/uploads/2024/05/gbtc-pixellated.jpg&w=1920&q=75&webp=false
https://blockworks.co/news/hong-kong-crypto-etfs-usa-eth,Blockworks,https://blockworks.co/search,What Hong Kong crypto ETFs may tell us about US ETH fund appetite,"Access to staking rewards is expected to be key for wider adoption of ether ETFs in the future, analysts say.",Ben Strack,2024-05-06,News,https://blockworks.co/_next/image?url=https://blockworks-co.imgix.net/wp-content/uploads/2024/05/eth-tokens.jpg&w=1920&q=75&webp=false
https://blockworks.co/,Blockworks,https://blockworks.co/search,Blockworks: News and insights about digital assets.,"Blockworks is a financial media brand that delivers breaking news and premium insights about digital assets to millions of investors. Our editorial content, newsletters, podcasts and events provide investors with the critical analysis and information they need to make smarter decisions about digital assets.",Blockworks,2024-05-07,News,https://blockworks.co/_next/image?url=https://blockworks.co/images/meta-logo.png&w=1920&q=75&webp=false
https://blockworks.co/careers,Blockworks,https://blockworks.co/search,Blockworks: News and insights about digital assets.,"Blockworks is a financial media brand that delivers breaking news and premium insights about digital assets to millions of investors. Our editorial content, newsletters, podcasts and events provide investors with the critical analysis and information they need to make smarter decisions about digital assets.",Blockworks,2024-05-07,News,https://blockworks.co/images/blockworks-og-image.webp
https://blockworks.co/newsletter,Blockworks,https://blockworks.co/search,Blockworks Newsletter - Understand the crypto markets in just 5 minutes,"Blockworks is a financial media brand that delivers breaking news and premium insights about digital assets to millions of investors. Our editorial content, newsletters, podcasts and events provide investors with the critical analysis and information they need to make smarter decisions about digital assets.",Blockworks,2024-05-07,News,https://blockworks.co/_next/image?url=https://cms.blockworks.co/wp-content/uploads/2021/01/Blockworks_Newsletter_2.jpg?20221121&w=1920&q=75&webp=false
https://blockworks.co/author/alun-evans,Blockworks,https://blockworks.co/search,Posts of Alun Evans - Blockworks,"With over 20 years of experience leading and designing games and tech companies, Alun is well-versed in creating innovative products that tackle experiential and developer challenges. In addition to his stewardship of LAOS Network, he is CEO and co-founder of the company building LAOS, Freeverse, which focuses on building scalable blockchain infrastructure. His history as the co-creator of ‘Barcelona World Race - THE GAME,’ a cutting-edge video game enabling virtual participation in real-world events, and his wider passion for gaming, have fed into his vision for LAOS Network as a solution for the intersection of Web3 tech with both gaming and real-world applications. Alun also led Shar3d.io, a pioneering company enabling collaborative 3D web applications, and served as CTO of Bodypal.com, a virtual garment services company. He holds a Ph.D. in Medical Physics from University College London.

",Blockworks,2024-05-07,News,https://blockworks.co/images/blockworks-og-image.webp
https://blockworks.co/privacy-policy,Blockworks,https://blockworks.co/search,Privacy Policy - Blockworks,"Blockworks is a financial media brand that delivers breaking news and premium insights about digital assets to millions of investors. Our editorial content, newsletters, podcasts and events provide investors with the critical analysis and information they need to make smarter decisions about digital assets.",Blockworks,2024-05-07,News,https://blockworks.co/images/blockworks-og-image.webp
https://blockworks.co/news/robinhood-wells-notice-sec,Blockworks,https://blockworks.co/search,Robinhood discloses Wells notice over its crypto business,Robinhood’s chief legal officer said the notice came after “years of good faith attempts” to work with the SEC.,Katherine Ross,2024-05-06,News,https://blockworks.co/_next/image?url=https://blockworks-co.imgix.net/wp-content/uploads/2024/05/Vlad-Tenev-PMLS-2.jpg&w=1920&q=75&webp=false
https://blockworks.co/author/bessieliu,Blockworks,https://blockworks.co/search,Posts of Bessie Liu - Blockworks,"Bessie is a Brooklyn-based reporter covering DeFi and technology. Bessie worked as a tech journalist for The Org prior to joining Blockworks and was a management consultant for KPMG in another life. She is originally from Melbourne, Australia and holds an MA from New York University. She is also the mother of a bratty cat named Mochi. You can reach Bessie at bessie@blockworks.co",Blockworks,2024-05-07,News,https://blockworks.co/images/blockworks-og-image.webp
https://blockworks.co/news/future-tokenization-permissioned-blockchains,Blockworks,https://blockworks.co/search,The future of tokenization? Permissioned blockchains,"Opinion: Despite BlackRock’s fund on Ethereum, the future of tokenization is really with permissioned blockchains.",Graeme Moore,2024-05-06,News,https://blockworks.co/_next/image?url=https://blockworks-co.imgix.net/wp-content/uploads/2024/05/ED_ethGeneral_20240125d.jpg&w=1920&q=75&webp=false
https://blockworks.co/category/uncategorized,Blockworks,https://blockworks.co/search,Uncategorized News & Insights - Blockworks,There are a total of 5 articles associated with Uncategorized.,Blockworks,2024-05-06,News,https://blockworks.co/images/blockworks-og-image.webp
https://blockworks.co/category/business,Blockworks,https://blockworks.co/search,Business News & Insights - Blockworks,"Crypto business news from Blockworks - hiring updates, funding announcements, blockchain industry news and everything you need to be a crypto insider.",Blockworks,2024-05-06,News,https://blockworks.co/images/blockworks-og-image.webp
https://blockworks.co/news/former-la-mayor-joins-coinbase,Blockworks,https://blockworks.co/search,Hiring roundup: Former LA mayor joins Coinbase,"A former mayor becomes latest Coinbase policy adviser, and the special counsel of a crypto venture firm leaves.",Bessie Liu,2024-05-05,News,https://blockworks.co/_next/image?url=https://blockworks-co.imgix.net/wp-content/uploads/2024/05/Antonio-Villaraigosa.jpg&w=1920&q=75&webp=false
https://blockworks.co/category/defi,Blockworks,https://blockworks.co/search,DeFi News & Insights - Blockworks,"Stay ahead of the curve with timely insights about decentralized finance (DeFi). Blockworks reports the news that moves the industry one way or the other.
",Blockworks,2024-05-06,News,https://blockworks.co/images/blockworks-og-image.webp
https://blockworks.co/news/cftc-rostin-benham-warns-crypto,Blockworks,https://blockworks.co/search,CFTC’s Behnam warns crypto industry that more enforcement actions are coming ,CFTC Chairman Rostin Behnam said a growing crypto industry and lack of US laws is going to inevitably lead to more enforcement actions.,Casey Wagner,2024-05-06,News,https://blockworks.co/_next/image?url=https://blockworks-co.imgix.net/wp-content/uploads/2024/05/Rostin-Benham.jpg&w=1920&q=75&webp=false
https://blockworks.co/contact-us,Blockworks,https://blockworks.co/search,Blockworks: News and insights about digital assets.,"Blockworks is a financial media brand that delivers breaking news and premium insights about digital assets to millions of investors. Our editorial content, newsletters, podcasts and events provide investors with the critical analysis and information they need to make smarter decisions about digital assets.",Blockworks,2024-05-07,News,https://blockworks.co/images/blockworks-og-image.webp
https://blockworks.co/news/empire-newsletter-doj-wallet-developers,Blockworks,https://blockworks.co/search,Empire Newsletter: The DOJ's about-face on money transmitters,The Justice Department is alleging that wallet developers should be charged with unlicensed money transmission.,Katherine Ross,2024-05-06,News,https://blockworks.co/_next/image?url=https://blockworks-co.imgix.net/wp-content/uploads/2024/05/merrick-garland.jpg&w=1920&q=75&webp=false
https://blockworks.co/bitcoin-etf,Blockworks,https://blockworks.co/search,Bitcoin ETF Tracker - Blockworks,Track the latest Bitcoin ETFs effortlessly with our Bitcoin ETF tracker. Our Bitcoin ETF Tracker has the key market information needed.,Blockworks,2024-05-07,News,https://blockworks.co/_next/image?url=https://blockworks.co/images/meta-logo.png&w=1920&q=75&webp=false
https://blockworks.co/category/policy,Blockworks,https://blockworks.co/search,Policy News & Insights - Blockworks,"Blockworks covers a diverse range of cryptocurrency regulatory topics including SEC complaints, banking regulation, anti-money laundering and bipartisan legislation.",Blockworks,2024-05-06,News,https://blockworks.co/images/blockworks-og-image.webp
https://blockworks.co/author/graeme-moore,Blockworks,https://blockworks.co/search,Posts of Graeme Moore - Blockworks,"Graeme Moore is the Head of Tokenization at the Polymesh Association, a not-for-profit dedicated to the growth of the Polymesh blockchain ecosystem. He is also the author of B is for Bitcoin, the first ever ABC book about Bitcoin. Prior to Polymesh, Graeme was the first employee at Polymath; the creative director at Spartan Race; and an associate at Canada’s largest independent investment advisory firm.",Blockworks,2024-05-07,News,https://blockworks.co/images/blockworks-og-image.webp
https://blockworks.co/category/web3,Blockworks,https://blockworks.co/search,Web3 News & Insights - Blockworks,Web3 is the third generation of the internet. where decentralized apps enable a more user driven experience. Stay up to date on Web 3 with Blockworks.,Blockworks,2024-05-06,News,https://blockworks.co/images/blockworks-og-image.webp
https://blockworks.co/news,Blockworks,https://blockworks.co/search,Blockworks,"Blockworks is a financial media brand that delivers breaking news and premium insights about digital assets to millions of investors. Our editorial content, newsletters, podcasts and events provide investors with the critical analysis and information they need to make smarter decisions about digital assets.",Blockworks,2024-05-07,News,https://blockworks.co/images/blockworks-og-image.webp
https://blockworks.co/news/a16z-90m-bid-optimism,Blockworks,https://blockworks.co/search,Funding Roundup: a16z made a $90M bid on Optimism,Venture capital firm Andreessen Horowitz has privately purchased $90 million worth of Optimism’s OP token.,Bessie Liu,2024-05-04,News,https://blockworks.co/_next/image?url=https://blockworks-co.imgix.net/wp-content/uploads/2024/05/funding-ben-franklin.jpg&w=1920&q=75&webp=false
https://blockworks.co/author/jack-kubinec,Blockworks,https://blockworks.co/search,Posts of Jack Kubinec - Blockworks,"Jack Kubinec is a DeFi and DAO reporter based in Brooklyn, New York. Jack previously interned at Blockworks before joining full-time. He graduated summa cum laude from Cornell University with a degree in sociology. Contact Jack at jack.kubinec@blockworks.co.",Blockworks,2024-05-07,News,https://blockworks.co/images/blockworks-og-image.webp
https://blockworks.co/author/benstrack,Blockworks,https://blockworks.co/search,Posts of Ben Strack - Blockworks,"Ben Strack is a senior reporter covering macro and crypto-native funds, financial advisors, structured products, and the integration of digital assets and DeFi into traditional finance. Prior to joining Blockworks, he covered the asset management industry for Fund Intelligence and was a reporter and editor for various local newspapers on Long Island. He graduated from the University of Maryland with a degree in journalism.

Contact Ben via email at ben@blockworks.co",Blockworks,2024-05-07,News,https://blockworks.co/images/blockworks-og-image.webp
https://blockworks.co/about,Blockworks,https://blockworks.co/search,Blockworks: News and insights about digital assets.,"Blockworks is a financial media brand that delivers breaking news and premium insights about digital assets to millions of investors. Our editorial content, newsletters, podcasts and events provide investors with the critical analysis and information they need to make smarter decisions about digital assets.",Blockworks,2024-05-07,News,https://blockworks.co/images/blockworks-og-image.webp
https://blockworks.co/news/why-etf-flows-do-dont-matter,Blockworks,https://blockworks.co/search,Why tracking bitcoin ETF flows matters. And why it doesn’t.,"Bitcoin ETF flows give a better glimpse of how a segment of the market views crypto, but analysts say it’s worth filtering out short-term noise.",Ben Strack,2024-05-03,News,https://blockworks.co/_next/image?url=https://blockworks-co.imgix.net/wp-content/uploads/2024/05/pink-3d-btc.jpg&w=1920&q=75&webp=false
https://blockworks.co/news/base-kicks-off-onchain-summer,Blockworks,https://blockworks.co/search,Web3 Watch: Base kicks off Onchain Summer 2.0,"Coinbase’s Base kicks off Onchain Summer 2.0, and NodeMonkes is now the most popular Bitcoin NFT.",Bessie Liu,2024-05-05,News,https://blockworks.co/_next/image?url=https://blockworks-co.imgix.net/wp-content/uploads/2024/05/Base-Coinbase.jpg&w=1920&q=75&webp=false
https://blockworks.co/sitemap,Blockworks,https://blockworks.co/search,Sitemap - Blockworks,"Blockworks is a financial media brand that delivers breaking news and premium insights about digital assets to millions of investors. Our editorial content, newsletters, podcasts and events provide investors with the critical analysis and information they need to make smarter decisions about digital assets.",Blockworks,2024-05-07,News,https://blockworks.co/images/blockworks-og-image.webp
https://blockworks.co/podcasts,Blockworks,https://blockworks.co/search,Podcasts - Blockworks,"Blockworks is a financial media brand that delivers breaking news and premium insights about digital assets to millions of investors. Our editorial content, newsletters, podcasts and events provide investors with the critical analysis and information they need to make smarter decisions about digital assets.",Blockworks,2024-05-07,News,https://blockworks.co/images/blockworks-og-image.webp
https://blockworks.co/webinars,Blockworks,https://blockworks.co/search,Webinars - Blockworks,"Blockworks is a financial media brand that delivers breaking news and premium insights about digital assets to millions of investors. Our editorial content, newsletters, podcasts and events provide investors with the critical analysis and information they need to make smarter decisions about digital assets.",Blockworks,2024-05-07,News,https://blockworks.co/images/blockworks-og-image.webp
https://blockworks.co/author/casey-wagner,Blockworks,https://blockworks.co/search,Posts of Casey Wagner - Blockworks,"​​Casey Wagner is a Senior Reporter based in New York. Casey covers crypto regulation, markets and central banks. Prior to joining Blockworks, she reported on macroeconomics at Bloomberg News. She graduated from the University of Virginia with a degree in Media Studies. Contact Casey via email at casey@blockworks.co",Blockworks,2024-05-07,News,https://blockworks.co/images/blockworks-og-image.webp
https://blockworks.co/prices,Blockworks,https://blockworks.co/search,"Cryptocurrency Prices, Charts And Market Caps - Blockworks","Blockworks is a financial media brand that delivers breaking news and premium insights about digital assets to millions of investors. Our editorial content, newsletters, podcasts and events provide investors with the critical analysis and information they need to make smarter decisions about digital assets.",Blockworks,2024-05-07,News,https://blockworks.co/images/blockworks-og-image.webp
https://blockworks.co/events,Blockworks,https://blockworks.co/search,Events - Blockworks,"Blockworks is a financial media brand that delivers breaking news and premium insights about digital assets to millions of investors. Our editorial content, newsletters, podcasts and events provide investors with the critical analysis and information they need to make smarter decisions about digital assets.",Blockworks,2024-05-06,News,https://blockworks.co/_next/image?url=https://cms.blockworks.co/wp-content/uploads/2021/05/Blockworks-Events_16x9_v3-up-2.jpg&w=1920&q=75&webp=false
https://blockworks.co/news/gaming-needs-tokenization,Blockworks,https://blockworks.co/search,Gaming needs tokenization,"Opinion: If we get it right, the future of gaming will be a more open, collaborative and rewarding space for all.",Alun Evans,2024-05-04,News,https://blockworks.co/_next/image?url=https://blockworks-co.imgix.net/wp-content/uploads/2024/05/gaming3.jpg&w=1920&q=75&webp=false
https://blockworks.co/search,Blockworks,https://blockworks.co/search,Search - Blockworks,"Blockworks is a financial media brand that delivers breaking news and premium insights about digital assets to millions of investors. Our editorial content, newsletters, podcasts and events provide investors with the critical analysis and information they need to make smarter decisions about digital assets.",Blockworks,2024-05-07,News,https://blockworks.co/images/blockworks-og-image.webp
https://blockworks.co/author/katherine-ross,Blockworks,https://blockworks.co/search,Posts of Katherine Ross - Blockworks,Katherine is a news editor based in Austin. She worked as a senior producer and correspondent at TheStreet prior to joining Blockworks. She holds a Bachelor of Arts degree with a focus on journalism from Sarah Lawrence. Contact Katherine via email at katherine@blockworks.co.,Blockworks,2024-05-07,News,https://blockworks.co/images/blockworks-og-image.webp
https://blockworks.co/category/finance,Blockworks,https://blockworks.co/search,Finance News & Insights - Blockworks,There are a total of 1773 articles associated with Finance.,Blockworks,2024-05-06,News,https://blockworks.co/images/blockworks-og-image.webp
